Trecho,Código,Categoria
"essa etapa, porém eu mencionei anteriormente que muitos que trabalha com ML veem essa etapa de limpeza, coleta de dados e rotulação como a mais trabalhosa e mais importante, porque nem sempre você tem o cliente ou o especialista no dado a disposição para você.",Processamento de dados como etapa problemática se você não tem auxílio do cliente.,Desafio [Processamento de dados]
"Você precisa fazer isso manualmente, então… mas assim, que eu tente puxar aqui pela memória rapidamente, a gente não trabalhou muito nessa direção de limpeza, coleta e rotulação de dados, a gente diretamente.",Na empresa pouco se trabalhou sem o cliente no processamento de dados.,Limitação [Processamento de dados]
"é, essa pergunta é interessante também, no sentido de que se você já é do domínio - é a segunda vez que eu volto a esse ponto - se você conhece qual é a característica esperada daquele dado, se você já trabalhou em algo parecido antes, tudo fica mais fácil.",Ter experiência no domínio é de grande utilidade no processamento de dados ,Limitação [Processamento de dados]
"Por exemplo, hoje a gente tem trabalhado com imagens sísmicas, ao olhar para uma imagem hoje eu já sei se ela tem a qualidade necessária para gerar um bom resultado, se eu vou conseguir tirar um bom resultado dela ou se não, se eu vou ter que voltar para o cliente e dizer, ""olha não tem como processar esse dado? Não tem como entregar um dado com maior qualidade?"".",Entrevistado diz ter experiência na área que atua.,
,Desenvolvedor consegue perceber a qualidade de imagens úteis para a área que ele conhece ,Limitação [Processamento de dados]
,Melhorias de qualidade nos dados são solicitadas ao cliente.,Atividade [Processamento de dados]
"Agora se você não é do domínio essa avaliação é muito difícil, você não sabe qual é a característica de um dado bom ou um dado ruim, então nesse caso você não tem muito o que fazer.",Desenvolvedores que não são do domínio dificilmente percebem a qualidade nos dados que tem.,Limitação [Processamento de dados]
"Acho que um caminho possível é tentar rodar o modelo, rodar todo o workflow, essa pipeline aí de aprendizagem de máquina e ver se consegue um bom resultado, se você conseguir um bom resultado talvez isso indique que o dado é adequado. Se você não conseguir um bom resultado, acho que é o momento de voltar para quem te gerou o dado, né? Que geralmente no nosso caso é o cliente, e perguntar se não tem como... se ele não tem algum problema no dado ou se ele não consegue gerar um dado com melhor qualidade. Nesse caso aí é tentativa e erro, não tem jeito.",Desenvolvedores que não são do domínio tem que avaliar a qulidade do dados executando o workflow.,Atividade [Processamento de dados]
"eu acho que é isso, né? Você criar essa… essa experiência com o dado a ponto de você começar a ter um sentimento do que é um dado com boa qualidade, o que é um dado com baixa qualidade, é… qual é o resultado esperado.",Um desafio do processamento de dados é adquirir essa capacidade de perceber a qualidade do dado de certo domínio.,Desafio [Processamento de dados]
"Por exemplo, tem problemas de ML que são tão complicados que mesmo com dados de boa qualidade, você não consegue uma acurácia tão alta, porque o problema é complicado, então uma vez que você já tenha essa noção a priori, você já sabe o que esperar.",Alguns problemas de ML são complicados por natureza e nem dados de boa qualidade rendem bons resultados ,Limitação [Geral]
"Se você não tem, e é a primeira vez que você está trabalhando com aquele dado, se você tem uma acurácia baixa já acende uma alerta de que o dado pode estar com problema, ou tem um problema no seu modelo. Mas na verdade não é, é o melhor que se consegue porque o problema é complicado, né? Acho que a experiência da pessoa trabalhando naquele dado, naquele projeto, com aquele tipo de problema é fundamental para que você consiga enxergar essas coisas de maneira mais fácil.",Trabalhar com problemas complicados pode gerar a falsa impressão que algo de errado existe no workflow.,Limitação [Geral]
"Caso você não tenha essa experiência, é tentativa e erro mesmo, não tem jeito. Ou claro, você pode acionar um colega, caso você tenha alguém disponível que tenha essa experiência, ou até mesmo, como eu já falei voltar ao cliente, tentar entender um pouco melhor, ou até mesmo para artigos e livros que possam ajudar nesse processo.",Se não há experiência no domínio o trabalho é de tentativa e erro ,Limitação [Geral]
,Artigos e livros são úteis para aprender sobre um domínio.,